<?xml version="1.0" encoding="UTF-8"?><!--Compiere(r) Release 2.5.2f_2005-09-01 - Smart ERP & CRM - (c) 1999-2005 Compiere (r); Implementation: unknown - not supported--><!--<!DOCTYPE compiereTrl PUBLIC "-//ComPiere, Inc.//DTD Compiere Translation 1.0//EN" "http://www.compiere.org/dtd/compiereTrl.dtd">--><compiereTrl language="en_US" table="W_Store"><row id="11" trl="Y"><value column="EMailFooter" original=""></value><value column="EMailHeader" original=""></value><value column="WebInfo" original=""></value><value column="WebParam1" original="Compiere120x60.gif">Compiere120x60.gif</value><value column="WebParam2" original="&lt;h1&gt;Web Store&lt;/h1&gt;">&lt;h1&gt;Web Store&lt;/h1&gt;</value><value column="WebParam3" original="Parameter3">Parameter3</value><value column="WebParam4" original="Parameter4">Parameter4</value><value column="WebParam5" original="Parameter5">Parameter5</value><value column="WebParam6" original="Parameter6">Parameter6</value></row></compiereTrl>